[
  {
    "rule_id": "CUSTOM_AUX_DID_WENT",
    "title": "Base verb after did: went",
    "grammar_category": "auxiliary",
    "implementation": "weir",
    "status": "experimental",
    "confidence": "high",
    "auto_apply": true,
    "false_positive_risk": "low",
    "source_basis": "general English grammar principle",
    "description": "Uses the base verb after did in a narrow irregular-verb case.",
    "lexicons": ["irregular_verbs.json"],
    "positive_test_count": 5,
    "negative_test_count": 10,
    "benchmark_categories": ["Agreement Errors"],
    "known_limitations": ["Only covers the exact irregular form went."]
  },
  {
    "rule_id": "CUSTOM_AUX_DID_SAW",
    "title": "Base verb after did: saw",
    "grammar_category": "auxiliary",
    "implementation": "weir",
    "status": "experimental",
    "confidence": "high",
    "auto_apply": true,
    "false_positive_risk": "low",
    "source_basis": "general English grammar principle",
    "description": "Uses the base verb after did in a narrow irregular-verb case.",
    "lexicons": ["irregular_verbs.json"],
    "positive_test_count": 5,
    "negative_test_count": 10,
    "benchmark_categories": ["Agreement Errors"],
    "known_limitations": ["Only covers the exact irregular form saw."]
  },
  {
    "rule_id": "CUSTOM_AUX_DID_WROTE",
    "title": "Base verb after did: wrote",
    "grammar_category": "auxiliary",
    "implementation": "weir",
    "status": "experimental",
    "confidence": "high",
    "auto_apply": true,
    "false_positive_risk": "low",
    "source_basis": "general English grammar principle",
    "description": "Uses the base verb after did in a narrow irregular-verb case.",
    "lexicons": ["irregular_verbs.json"],
    "positive_test_count": 5,
    "negative_test_count": 10,
    "benchmark_categories": ["Agreement Errors"],
    "known_limitations": ["Only covers the exact irregular form wrote."]
  },
  {
    "rule_id": "CUSTOM_AUX_DID_MADE",
    "title": "Base verb after did: made",
    "grammar_category": "auxiliary",
    "implementation": "weir",
    "status": "experimental",
    "confidence": "high",
    "auto_apply": true,
    "false_positive_risk": "low",
    "source_basis": "general English grammar principle",
    "description": "Uses the base verb after did in a narrow irregular-verb case.",
    "lexicons": ["irregular_verbs.json"],
    "positive_test_count": 5,
    "negative_test_count": 10,
    "benchmark_categories": ["Agreement Errors"],
    "known_limitations": ["Only covers the exact irregular form made."]
  },
  {
    "rule_id": "CUSTOM_AUX_DID_TOOK",
    "title": "Base verb after did: took",
    "grammar_category": "auxiliary",
    "implementation": "weir",
    "status": "experimental",
    "confidence": "high",
    "auto_apply": true,
    "false_positive_risk": "low",
    "source_basis": "general English grammar principle",
    "description": "Uses the base verb after did in a narrow irregular-verb case.",
    "lexicons": ["irregular_verbs.json"],
    "positive_test_count": 5,
    "negative_test_count": 10,
    "benchmark_categories": ["Agreement Errors"],
    "known_limitations": ["Only covers the exact irregular form took."]
  },
  {
    "rule_id": "CUSTOM_MODAL_CAN_TO",
    "title": "Remove unnecessary to after can",
    "grammar_category": "modal",
    "implementation": "weir",
    "status": "experimental",
    "confidence": "high",
    "auto_apply": true,
    "false_positive_risk": "low",
    "source_basis": "general English grammar principle",
    "description": "Removes a redundant to after can in a local phrase.",
    "lexicons": [],
    "positive_test_count": 5,
    "negative_test_count": 10,
    "benchmark_categories": ["Agreement Errors"],
    "known_limitations": ["Does not handle paraphrased modal constructions."]
  },
  {
    "rule_id": "CUSTOM_MODAL_SHOULD_TO",
    "title": "Remove unnecessary to after should",
    "grammar_category": "modal",
    "implementation": "weir",
    "status": "experimental",
    "confidence": "high",
    "auto_apply": true,
    "false_positive_risk": "low",
    "source_basis": "general English grammar principle",
    "description": "Removes a redundant to after should in a local phrase.",
    "lexicons": [],
    "positive_test_count": 5,
    "negative_test_count": 10,
    "benchmark_categories": ["Agreement Errors"],
    "known_limitations": ["Does not handle paraphrased modal constructions."]
  },
  {
    "rule_id": "CUSTOM_MODAL_MUST_TO",
    "title": "Remove unnecessary to after must",
    "grammar_category": "modal",
    "implementation": "weir",
    "status": "experimental",
    "confidence": "high",
    "auto_apply": true,
    "false_positive_risk": "low",
    "source_basis": "general English grammar principle",
    "description": "Removes a redundant to after must in a local phrase.",
    "lexicons": [],
    "positive_test_count": 5,
    "negative_test_count": 10,
    "benchmark_categories": ["Agreement Errors"],
    "known_limitations": ["Does not handle paraphrased modal constructions."]
  },
  {
    "rule_id": "CUSTOM_MODAL_WOULD_TO",
    "title": "Remove unnecessary to after would",
    "grammar_category": "modal",
    "implementation": "weir",
    "status": "experimental",
    "confidence": "high",
    "auto_apply": true,
    "false_positive_risk": "low",
    "source_basis": "general English grammar principle",
    "description": "Removes a redundant to after would in a local phrase.",
    "lexicons": [],
    "positive_test_count": 5,
    "negative_test_count": 10,
    "benchmark_categories": ["Agreement Errors"],
    "known_limitations": ["Does not handle paraphrased modal constructions."]
  },
  {
    "rule_id": "CUSTOM_COMP_MORE_BETTER",
    "title": "Avoid more better",
    "grammar_category": "comparison",
    "implementation": "weir",
    "status": "experimental",
    "confidence": "high",
    "auto_apply": true,
    "false_positive_risk": "low",
    "source_basis": "general English grammar principle",
    "description": "Collapses a narrow double-comparative pattern.",
    "lexicons": ["comparison_forms.json"],
    "positive_test_count": 5,
    "negative_test_count": 10,
    "benchmark_categories": ["Agreement Errors"],
    "known_limitations": ["Only covers one fixed comparative phrase."]
  },
  {
    "rule_id": "CUSTOM_COMP_MORE_FASTER",
    "title": "Avoid more faster",
    "grammar_category": "comparison",
    "implementation": "weir",
    "status": "experimental",
    "confidence": "high",
    "auto_apply": true,
    "false_positive_risk": "low",
    "source_basis": "general English grammar principle",
    "description": "Collapses a narrow double-comparative pattern.",
    "lexicons": ["comparison_forms.json"],
    "positive_test_count": 5,
    "negative_test_count": 10,
    "benchmark_categories": ["Agreement Errors"],
    "known_limitations": ["Only covers one fixed comparative phrase."]
  },
  {
    "rule_id": "CUSTOM_COMP_MOST_BEST",
    "title": "Avoid most best",
    "grammar_category": "comparison",
    "implementation": "weir",
    "status": "experimental",
    "confidence": "high",
    "auto_apply": true,
    "false_positive_risk": "low",
    "source_basis": "general English grammar principle",
    "description": "Collapses a narrow double-superlative pattern.",
    "lexicons": ["comparison_forms.json"],
    "positive_test_count": 5,
    "negative_test_count": 10,
    "benchmark_categories": ["Agreement Errors"],
    "known_limitations": ["Only covers one fixed superlative phrase."]
  },
  {
    "rule_id": "CUSTOM_COMP_MOST_WORST",
    "title": "Avoid most worst",
    "grammar_category": "comparison",
    "implementation": "weir",
    "status": "experimental",
    "confidence": "high",
    "auto_apply": true,
    "false_positive_risk": "low",
    "source_basis": "general English grammar principle",
    "description": "Collapses a narrow double-superlative pattern.",
    "lexicons": ["comparison_forms.json"],
    "positive_test_count": 5,
    "negative_test_count": 10,
    "benchmark_categories": ["Agreement Errors"],
    "known_limitations": ["Only covers one fixed superlative phrase."]
  },
  {
    "rule_id": "CUSTOM_REPEATED_DETERMINER_THE",
    "title": "Remove repeated the",
    "grammar_category": "repetition",
    "implementation": "weir",
    "status": "experimental",
    "confidence": "high",
    "auto_apply": true,
    "false_positive_risk": "low",
    "source_basis": "general English grammar principle",
    "description": "Removes adjacent repeated definite articles.",
    "lexicons": [],
    "positive_test_count": 5,
    "negative_test_count": 10,
    "benchmark_categories": ["Inconsistent Spacing"],
    "known_limitations": ["Only handles immediate repetition."]
  },
  {
    "rule_id": "CUSTOM_REPEATED_DETERMINER_A",
    "title": "Remove repeated a",
    "grammar_category": "repetition",
    "implementation": "weir",
    "status": "experimental",
    "confidence": "high",
    "auto_apply": true,
    "false_positive_risk": "low",
    "source_basis": "general English grammar principle",
    "description": "Removes adjacent repeated indefinite articles.",
    "lexicons": [],
    "positive_test_count": 5,
    "negative_test_count": 10,
    "benchmark_categories": ["Inconsistent Spacing"],
    "known_limitations": ["Only handles immediate repetition."]
  },
  {
    "rule_id": "CUSTOM_REPEATED_AUX_IS",
    "title": "Remove repeated is",
    "grammar_category": "repetition",
    "implementation": "weir",
    "status": "experimental",
    "confidence": "high",
    "auto_apply": true,
    "false_positive_risk": "low",
    "source_basis": "general English grammar principle",
    "description": "Removes a duplicated auxiliary in a local phrase.",
    "lexicons": [],
    "positive_test_count": 5,
    "negative_test_count": 10,
    "benchmark_categories": ["Agreement Errors"],
    "known_limitations": ["Only handles immediate repetition."]
  },
  {
    "rule_id": "CUSTOM_PRONOUN_BETWEEN_YOU_AND_I",